{
  "experiment_id": "exp-linear-screening-1",
  "status": "evaluated",
  "primary_metric": 0.825,
  "metrics": {
    "balanced_accuracy": 0.825
  },
  "constraints": {
    "inference_latency_ms": {
      "threshold": 50.0,
      "value": 1.2,
      "verdict": "pass",
      "enforcement": "measured"
    },
    "bundle_bytes": {
      "threshold": 10485760,
      "value": 25600,
      "verdict": "pass",
      "enforcement": "measured"
    }
  },
  "is_feasible": true,
  "train_ms": 12.5,
  "model_sha256": "0123456789abcdef0123456789abcdef0123456789abcdef0123456789abcdef",
  "predictions_sha256": "abcdef0123456789abcdef0123456789abcdef0123456789abcdef0123456789",
  "artifact_path": "trials/exp-linear-screening-1/trial.json"
}
